{
  "$schema": "https://json-schema.org/draft-07/schema#",
  "$id": "https://cruisinginthewake.com/assets/data/tipping/_schema.json",
  "title": "Cruise Line Tipping Configuration",
  "type": "object",
  "required": ["schemaVersion", "lineId", "displayName", "verifiedAt", "currency", "region", "policyUrls", "bundledInFare", "recommendedCashExtras"],
  "properties": {
    "schemaVersion": { "type": "string", "const": "1.1" },
    "lineId":        { "type": "string", "description": "Slug matching brands.json id" },
    "displayName":   { "type": "string" },
    "effectiveDate": { "type": ["string", "null"], "format": "date", "description": "Date the current rates took effect; null for bundled lines." },
    "verifiedAt":    { "type": "string", "format": "date" },
    "currency":      { "type": "string", "description": "ISO 4217 code for the rate values shown." },
    "region":        { "type": "string", "description": "Sailing region where these rates apply (\"global\" if not regional)." },
    "policyUrls":    { "type": "array", "items": { "type": "string", "format": "uri" }, "minItems": 1 },
    "bundledInFare": { "type": "boolean" },
    "bundledNote":   { "type": "string" },
    "notes":         { "type": "string", "description": "Free-text notes (e.g., regional variations, prepaid-vs-onboard split)." },
    "dailyRates": {
      "oneOf": [
        { "type": "null" },
        {
          "type": "object",
          "required": ["tiers"],
          "properties": {
            "tiers": {
              "type": "array",
              "minItems": 1,
              "items": {
                "type": "object",
                "required": ["slug", "label", "amount", "isDefault", "appliesTo"],
                "properties": {
                  "slug":      { "type": "string", "description": "Stable identifier (e.g., 'standard', 'mini-suite', 'suite')." },
                  "label":     { "type": "string", "description": "Human-readable label shown in the UI dropdown." },
                  "amount":    { "type": "number", "minimum": 0 },
                  "isDefault": { "type": "boolean" },
                  "appliesTo": { "type": "string" }
                }
              }
            },
            "upcomingChange": {
              "oneOf": [
                { "type": "null" },
                {
                  "type": "object",
                  "required": ["effectiveDate", "tiers"],
                  "properties": {
                    "effectiveDate":          { "type": "string", "format": "date" },
                    "tiers":                  { "type": "array", "items": { "type": "object", "required": ["slug", "amount"], "properties": { "slug": { "type": "string" }, "amount": { "type": "number" } } } },
                    "autoGratuitiesPercent":  { "type": "number" },
                    "note":                   { "type": "string" }
                  }
                }
              ]
            }
          }
        }
      ]
    },
    "childPolicy": {
      "oneOf": [
        { "type": "null" },
        {
          "type": "object",
          "properties": {
            "exemptUnderAge": { "type": ["number", "null"] },
            "notes":          { "type": "string" }
          }
        }
      ]
    },
    "autoGratuities": {
      "oneOf": [
        { "type": "null" },
        {
          "type": "object",
          "properties": {
            "bar":             { "$ref": "#/$defs/percent" },
            "spa":             { "$ref": "#/$defs/percent" },
            "specialtyDining": { "$ref": "#/$defs/percent" },
            "roomService":     { "$ref": "#/$defs/percent" }
          }
        }
      ]
    },
    "recommendedCashExtras": {
      "type": "object",
      "additionalProperties": {
        "type": "object",
        "required": ["default", "note"],
        "properties": {
          "default":     { "type": "number", "minimum": 0 },
          "perDay":      { "type": "boolean" },
          "perBag":      { "type": "boolean" },
          "perPerson":   { "type": "boolean" },
          "perVisit":    { "type": "boolean" },
          "note":        { "type": "string" }
        }
      }
    }
  },
  "$defs": {
    "percent": {
      "oneOf": [
        { "type": "null" },
        {
          "type": "object",
          "required": ["percent", "appliesTo"],
          "properties": { "percent": { "type": ["number", "null"] }, "appliesTo": { "type": "string" } }
        }
      ]
    }
  }
}
