{
  "schemaVersion": "1.1",
  "lineId": "royal-caribbean",
  "displayName": "Royal Caribbean International",
  "effectiveDate": "2024-11-01",
  "verifiedAt": "2026-05-08",
  "currency": "USD",
  "region": "global",
  "policyUrls": [
    "https://www.royalcaribbean.com/faq/questions/onboard-service-gratuity-expense",
    "https://www.royalcaribbeanblog.com/2024/10/08/royal-caribbean-quietly-raising-the-daily-gratuity-charges"
  ],
  "bundledInFare": false,
  "notes": "Suite tier covers Sky Junior Suite, Grand Suite, and above. Junior Suites pay the standard rate. No 2026 hike announced.",
  "dailyRates": {
    "tiers": [
      { "slug": "standard", "label": "Standard stateroom", "amount": 18.50, "isDefault": true,  "appliesTo": "Interior, Oceanview, Balcony, and Junior Suite staterooms" },
      { "slug": "suite",    "label": "Suite",              "amount": 21.00, "isDefault": false, "appliesTo": "Sky Junior Suite, Grand Suite, and above" }
    ],
    "upcomingChange": null
  },
  "childPolicy": {
    "exemptUnderAge": null,
    "notes": "Official FAQ does not specify a child exemption age."
  },
  "autoGratuities": {
    "bar":             { "percent": 18, "appliesTo": "Bar beverages, drink packages, mini bar" },
    "spa":             { "percent": 20, "appliesTo": "Spa and salon services" },
    "specialtyDining": { "percent": 18, "appliesTo": "Specialty restaurants" },
    "roomService":     { "percent": 18, "appliesTo": "Room-service orders" }
  },
  "recommendedCashExtras": {
    "stewardThankYou":   { "default": 0,  "perDay": false, "note": "Daily charge covers stateroom attendant; cash is optional." },
    "headWaiter":        { "default": 25, "perDay": false, "note": "End-of-cruise envelope, optional." },
    "asstWaiter":        { "default": 15, "perDay": false, "note": "End-of-cruise envelope, optional." },
    "butler":            { "default": 5,  "perDay": true,  "note": "Star Class suites include a Royal Genie; daily gratuity is included, cash thank-you is optional. Other suite tiers do not have butler service." },
    "concierge":         { "default": 0,  "perDay": false, "note": "Optional thank-you for Suite Concierge / Diamond Lounge concierge service." },
    "porterPerBag":      { "default": 2,  "perBag": true,  "note": "Embarkation porter, US dollars." },
    "kidsClubCounselor": { "default": 10, "perDay": false, "note": "Optional, end of cruise — Adventure Ocean counselors." },
    "excursionGuide":    { "default": 5,  "perPerson": true, "note": "Per person, ship-sponsored excursion." },
    "excursionDriver":   { "default": 2,  "perPerson": true, "note": "Per person, on driver-led portions." },
    "casinoDealer":      { "default": 5,  "perVisit": true, "note": "Per session, optional, US dollars." }
  }
}
